Title,Authors,Abstract,URL,Submitted Date
Generating Synergistic Formulaic Alpha Collections via Reinforcement Learning,"Shuo Yu, Hongyan Xue, Xiang Ao, Feiyang Pan, Jia He, Dandan Tu, Qing He","In the field of quantitative trading, it is common practice to transform raw historical stock data into indicative signals for the market trend. Such signals are called alpha factors. Alphas in formula forms are more interpretable and thus favored by practitioners concerned with risk. In practice, a set of formulaic alphas is often used together for better modeling precision, so we need to find synergistic formulaic alpha sets that work well together. However, most traditional alpha generators mine alphas one by one separately, overlooking the fact that the alphas would be combined later. In this paper, we propose a new alpha-mining framework that prioritizes mining a synergistic set of alphas, i.e., it directly uses the performance of the downstream combination model to optimize the alpha generator. Our framework also leverages the strong exploratory capabilities of reinforcement learning~(RL) to better explore the vast search space of formulaic alphas. The contribution to the combination models' performance is assigned to be the return used in the RL process, driving the alpha generator to find better alphas that improve upon the current set. Experimental evaluations on real-world stock market data demonstrate both the effectiveness and the efficiency of our framework for stock trend forecasting. The investment simulation results show that our framework is able to achieve higher returns compared to previous approaches. △ Less",https://arxiv.orghttps://arxiv.org/abs/2306.12964,June 2023
xSIM++: An Improved Proxy to Bitext Mining Performance for Low-Resource Languages,"Mingda Chen, Kevin Heffernan, Onur Çelebi, Alex Mourachko, Holger Schwenk","We introduce a new proxy score for evaluating bitext mining based on similarity in a multilingual embedding space: xSIM++. In comparison to xSIM, this improved proxy leverages rule-based approaches to extend English sentences in any evaluation set with synthetic, hard-to-distinguish examples which more closely mirror the scenarios we encounter during large-scale mining. We validate this proxy by running a significant number of bitext mining experiments for a set of low-resource languages, and subsequently train NMT systems on the mined data. In comparison to xSIM, we show that xSIM++ is better correlated with the downstream BLEU scores of translation systems trained on mined bitexts, providing a reliable proxy of bitext mining performance without needing to run expensive bitext mining pipelines. xSIM++ also reports performance for different error types, offering more fine-grained feedback for model development. △ Less",https://arxiv.orghttps://arxiv.org/abs/2306.12907,June 2023
Constructing Colloquial Dataset for Persian Sentiment Analysis of Social Microblogs,"Mojtaba Mazoochi, Leyla Rabiei, Farzaneh Rahmani, Zeinab Rajabi","Introduction: Microblogging websites have massed rich data sources for sentiment analysis and opinion mining. In this regard, sentiment classification has frequently proven inefficient because microblog posts typically lack syntactically consistent terms and representatives since users on these social networks do not like to write lengthy statements. Also, there are some limitations to low-resource languages. The Persian language has exceptional characteristics and demands unique annotated data and models for the sentiment analysis task, which are distinctive from text features within the English dialect. Method: This paper first constructs a user opinion dataset called ITRC-Opinion by collaborative environment and insource way. Our dataset contains 60,000 informal and colloquial Persian texts from social microblogs such as Twitter and Instagram. Second, this study proposes a new deep convolutional neural network (CNN) model for more effective sentiment analysis of colloquial text in social microblog posts. The constructed datasets are used to evaluate the presented model. Furthermore, some models, such as LSTM, CNN-RNN, BiLSTM, and BiGRU with different word embeddings, including Fasttext, Glove, and Word2vec, investigated our dataset and evaluated the results. Results: The results demonstrate the benefit of our dataset and the proposed model (72% accuracy), displaying meaningful improvement in sentiment classification performance. △ Less",https://arxiv.orghttps://arxiv.org/abs/2306.12679,June 2023
Design of Energy Harvesting based Hardware for IoT Applications,"Satyajaswanth Badri, Mukesh Saini, Neeraj Goel","Internet of Things (IoT) devices are rapidly expanding in many areas, including deep mines, space, industrial environments, and health monitoring systems. Most of the sensors and actuators are battery-powered, and these batteries have a finite lifespan. Maintaining and replacing these many batteries increases the maintenance cost of IoT systems and causes massive environmental damage. Energy-harvesting devices (EHDs) are the alternative and promising solution for these battery-operated IoT devices. These EHDs collect energy from the environment and use it for daily computations, like collecting and processing data from the sensors and actuators. Using EHDs in IoT reduces overall maintenance costs and makes the IoT system energy-sufficient. However, energy availability from these EHDs is unpredictable, resulting in frequent power failures. Most of these devices use volatile memories as storage elements, implying that all collected data and decisions made by the IoT devices are lost during frequent power failures, resulting in two possible overheads. First, the IoT device must execute the application from the beginning whenever power comes back. Second, IoT devices may make wrong decisions by considering incomplete data, i.e., data-inconsistency issues. To address these two challenges, a computing model is required that backs up the collected data during power failures and restores it for later computations; this type of computing is defined as intermittent computing. However, this computing model doesn't work with conventional processors or memories. Non-volatile memory and processors are required to design a battery-less IoT device that supports intermittent computing. △ Less",https://arxiv.orghttps://arxiv.org/abs/2306.12019,June 2023
Hypergraph Classification via Persistent Homology,"Mehmet Emin Aktas, Thu Nguyen, Rakin Riza, Muhammad Ifte Islam, Esra Akbas","Persistent homology is a mathematical tool used for studying the shape of data by extracting its topological features. It has gained popularity in network science due to its applicability in various network mining problems, including clustering, graph classification, and graph neural networks. The definition of persistent homology for graphs is relatively straightforward, as graphs possess distinct intrinsic distances and a simplicial complex structure. However, hypergraphs present a challenge in preserving topological information since they may not have a simplicial complex structure. In this paper, we define several topological characterizations of hypergraphs in defining hypergraph persistent homology to prioritize different higher-order structures within hypergraphs. We further use these persistent homology filtrations in classifying four different real-world hypergraphs and compare their performance to the state-of-the-art graph neural network models. Experimental results demonstrate that persistent homology filtrations are effective in classifying hypergraphs and outperform the baseline models. To the best of our knowledge, this study represents the first systematic attempt to tackle the hypergraph classification problem using persistent homology. △ Less",https://arxiv.orghttps://arxiv.org/abs/2306.11484,June 2023
A Collection of Simulated Event Logs for Fairness Assessment in Process Mining,"Timo Pohl, Alessandro Berti, Mahnaz Sadat Qafari, Wil M. P. van der Aalst","The analysis of fairness in process mining is a significant aspect of data-driven decision-making, yet the advancement in this field is constrained due to the scarcity of event data that incorporates fairness considerations. To bridge this gap, we present a collection of simulated event logs, spanning four critical domains, which encapsulate a variety of discrimination scenarios. By simulating these event logs with CPN Tools, we ensure data with known ground truth, thereby offering a robust foundation for fairness analysis. These logs are made freely available under the CC-BY-4.0 license and adhere to the XES standard, thereby assuring broad compatibility with various process mining tools. This initiative aims to empower researchers with the requisite resources to test and develop fairness techniques within process mining, ultimately contributing to the pursuit of equitable, data-driven decision-making processes. △ Less",https://arxiv.orghttps://arxiv.org/abs/2306.11453,June 2023
Fingerprinting and Building Large Reproducible Datasets,"Romain Lefeuvre, Jessie Galasso, Benoit Combemale, Houari Sahraoui, Stefano Zacchiroli","Obtaining a relevant dataset is central to conducting empirical studies in software engineering. However, in the context of mining software repositories, the lack of appropriate tooling for large scale mining tasks hinders the creation of new datasets. Moreover, limitations related to data sources that change over time (e.g., code bases) and the lack of documentation of extraction processes make it difficult to reproduce datasets over time. This threatens the quality and reproducibility of empirical studies. In this paper, we propose a tool-supported approach facilitating the creation of large tailored datasets while ensuring their reproducibility. We leveraged all the sources feeding the Software Heritage append-only archive which are accessible through a unified programming interface to outline a reproducible and generic extraction process. We propose a way to define a unique fingerprint to characterize a dataset which, when provided to the extraction process, ensures that the same dataset will be extracted. We demonstrate the feasibility of our approach by implementing a prototype. We show how it can help reduce the limitations researchers face when creating or reproducing datasets. △ Less",https://arxiv.orghttps://arxiv.org/abs/2306.11391,June 2023
Visually grounded few-shot word learning in low-resource settings,"Leanne Nortje, Dan Oneata, Herman Kamper","We propose a visually grounded speech model that learns new words and their visual depictions from just a few word-image example pairs. Given a set of test images and a spoken query, we ask the model which image depicts the query word. Previous work has simplified this few-shot learning problem by either using an artificial setting with digit word-image pairs or by using a large number of examples per class. Moreover, all previous studies were performed using English speech-image data. We propose an approach that can work on natural word-image pairs but with less examples, i.e. fewer shots, and then illustrate how this approach can be applied for multimodal few-shot learning in a real low-resource language, Yoruba. Our approach involves using the given word-image example pairs to mine new unsupervised word-image training pairs from large collections of unlabelledspeech and images. Additionally, we use a word-to-image attention mechanism to determine word-image similarity. With this new model, we achieve better performance with fewer shots than previous approaches on an existing English benchmark. Many of the model's mistakes are due to confusion between visual concepts co-occurring in similar contexts. The experiments on Yoruba show the benefit of transferring knowledge from a multimodal model trained on a larger set of English speech-image data. △ Less",https://arxiv.orghttps://arxiv.org/abs/2306.11371,June 2023
ChatGPT Chemistry Assistant for Text Mining and Prediction of MOF Synthesis,"Zhiling Zheng, Oufan Zhang, Christian Borgs, Jennifer T. Chayes, Omar M. Yaghi","We use prompt engineering to guide ChatGPT in the automation of text mining of metal-organic frameworks (MOFs) synthesis conditions from diverse formats and styles of the scientific literature. This effectively mitigates ChatGPT's tendency to hallucinate information -- an issue that previously made the use of Large Language Models (LLMs) in scientific fields challenging. Our approach involves the development of a workflow implementing three different processes for text mining, programmed by ChatGPT itself. All of them enable parsing, searching, filtering, classification, summarization, and data unification with different tradeoffs between labor, speed, and accuracy. We deploy this system to extract 26,257 distinct synthesis parameters pertaining to approximately 800 MOFs sourced from peer-reviewed research articles. This process incorporates our ChemPrompt Engineering strategy to instruct ChatGPT in text mining, resulting in impressive precision, recall, and F1 scores of 90-99%. Furthermore, with the dataset built by text mining, we constructed a machine-learning model with over 86% accuracy in predicting MOF experimental crystallization outcomes and preliminarily identifying important factors in MOF crystallization. We also developed a reliable data-grounded MOF chatbot to answer questions on chemical reactions and synthesis procedures. Given that the process of using ChatGPT reliably mines and tabulates diverse MOF synthesis information in a unified format, while using only narrative language requiring no coding expertise, we anticipate that our ChatGPT Chemistry Assistant will be very useful across various other chemistry sub-disciplines. △ Less",https://arxiv.orghttps://arxiv.org/abs/2306.11296,June 2023
Using Motif Transitions for Temporal Graph Generation,"Penghang Liu, A. Erdem Sarıyüce","Graph generative models are highly important for sharing surrogate data and benchmarking purposes. Real-world complex systems often exhibit dynamic nature, where the interactions among nodes change over time in the form of a temporal network. Most temporal network generation models extend the static graph generation models by incorporating temporality in the generation process. More recently, temporal motifs are used to generate temporal networks with better success. However, existing models are often restricted to a small set of predefined motif patterns due to the high computational cost of counting temporal motifs. In this work, we develop a practical temporal graph generator, Motif Transition Model (MTM), to generate synthetic temporal networks with realistic global and local features. Our key idea is modeling the arrival of new events as temporal motif transition processes. We first calculate the transition properties from the input graph and then simulate the motif transition processes based on the transition probabilities and transition rates. We demonstrate that our model consistently outperforms the baselines with respect to preserving various global and local temporal graph statistics and runtime performance. △ Less",https://arxiv.orghttps://arxiv.org/abs/2306.11190,June 2023
Efficient Generalized Temporal Pattern Mining in Big Time Series Using Mutual Information,"Van Long Ho, Nguyen Ho, Torben Bach Pedersen, Panagiotis Papapetrou","Big time series are increasingly available from an ever wider range of IoT-enabled sensors deployed in various environments. Significant insights can be gained by mining temporal patterns from these time series. Temporal pattern mining (TPM) extends traditional pattern mining by adding event time intervals into extracted patterns, making them more expressive at the expense of increased time and space complexities. Besides frequent temporal patterns (FTPs), which occur frequently in the entire dataset, another useful type of temporal patterns are so-called rare temporal patterns (RTPs), which appear rarely but with high confidence. Mining rare temporal patterns yields additional challenges. For FTP mining, the temporal information and complex relations between events already create an exponential search space. For RTP mining, the support measure is set very low, leading to a further combinatorial explosion and potentially producing too many uninteresting patterns. Thus, there is a need for a generalized approach which can mine both frequent and rare temporal patterns. This paper presents our Generalized Temporal Pattern Mining from Time Series (GTPMfTS) approach with the following specific contributions: (1) The end-to-end GTPMfTS process taking time series as input and producing frequent/rare temporal patterns as output. (2) The efficient Generalized Temporal Pattern Mining (GTPM) algorithm mines frequent and rare temporal patterns using efficient data structures for fast retrieval of events and patterns during the mining process, and employs effective pruning techniques for significantly faster mining. (3) An approximate version of GTPM that uses mutual information, a measure of data correlation, to prune unpromising time series from the search space. △ Less",https://arxiv.orghttps://arxiv.org/abs/2306.10994,June 2023
Pattern Mining for Anomaly Detection in Graphs: Application to Fraud in Public Procurement,"Lucas Potin, Rosa Figueiredo, Vincent Labatut, Christine Largeron","In the context of public procurement, several indicators called red flags are used to estimate fraud risk. They are computed according to certain contract attributes and are therefore dependent on the proper filling of the contract and award notices. However, these attributes are very often missing in practice, which prohibits red flags computation. Traditional fraud detection approaches focus on tabular data only, considering each contract separately, and are therefore very sensitive to this issue. In this work, we adopt a graph-based method allowing leveraging relations between contracts, to compensate for the missing attributes. We propose PANG (Pattern-Based Anomaly Detection in Graphs), a general supervised framework relying on pattern extraction to detect anomalous graphs in a collection of attributed graphs. Notably, it is able to identify induced subgraphs, a type of pattern widely overlooked in the literature. When benchmarked on standard datasets, its predictive performance is on par with state-of-the-art methods, with the additional advantage of being explainable. These experiments also reveal that induced patterns are more discriminative on certain datasets. When applying PANG to public procurement data, the prediction is superior to other methods, and it identifies subgraph patterns that are characteristic of fraud-prone situations, thereby making it possible to better understand fraudulent behavior. △ Less",https://arxiv.orghttps://arxiv.org/abs/2306.10857,June 2023
LaDe: The First Comprehensive Last-mile Delivery Dataset from Industry,"Lixia Wu, Haomin Wen, Haoyuan Hu, Xiaowei Mao, Yutong Xia, Ergang Shan, Jianbin Zhen, Junhong Lou, Yuxuan Liang, Liuqing Yang, Roger Zimmermann, Youfang Lin, Huaiyu Wan","Real-world last-mile delivery datasets are crucial for research in logistics, supply chain management, and spatio-temporal data mining. Despite a plethora of algorithms developed to date, no widely accepted, publicly available last-mile delivery dataset exists to support research in this field. In this paper, we introduce \texttt{LaDe}, the first publicly available last-mile delivery dataset with millions of packages from the industry. LaDe has three unique characteristics: (1) Large-scale. It involves 10,677k packages of 21k couriers over 6 months of real-world operation. (2) Comprehensive information. It offers original package information, such as its location and time requirements, as well as task-event information, which records when and where the courier is while events such as task-accept and task-finish events happen. (3) Diversity. The dataset includes data from various scenarios, including package pick-up and delivery, and from multiple cities, each with its unique spatio-temporal patterns due to their distinct characteristics such as populations. We verify LaDe on three tasks by running several classical baseline models per task. We believe that the large-scale, comprehensive, diverse feature of LaDe can offer unparalleled opportunities to researchers in the supply chain community, data mining community, and beyond. The dataset homepage is publicly available at https://huggingface.co/datasets/Cainiao-AI/LaDe. △ Less",https://arxiv.orghttps://arxiv.org/abs/2306.10675,June 2023
Isabelle Formalisation of Original Representation Theorems,Marco B. Caminati,"In a recent paper, new theorems linking apparently unrelated mathematical objects (event structures from concurrency theory and full graphs arising in computational biology) were discovered by cross-site data mining on huge databases, and building on existing Isabelle-verified event structures enumeration algorithms. Given the origin and newness of such theorems, their formal verification is particularly desirable. This paper presents such a verification via Isabelle/HOL definitions and theorems, and exposes the technical challenges found in the process. The introduced formalisation completes the verification of Isabelle-verified event structure enumeration algorithms into a fully verified framework to link event structures to full graphs. △ Less",https://arxiv.orghttps://arxiv.org/abs/2306.10558,June 2023
Rapid Image Labeling via Neuro-Symbolic Learning,"Yifeng Wang, Zhi Tu, Yiwen Xiang, Shiyuan Zhou, Xiyuan Chen, Bingxuan Li, Tianyi Zhang","The success of Computer Vision (CV) relies heavily on manually annotated data. However, it is prohibitively expensive to annotate images in key domains such as healthcare, where data labeling requires significant domain expertise and cannot be easily delegated to crowd workers. To address this challenge, we propose a neuro-symbolic approach called Rapid, which infers image labeling rules from a small amount of labeled data provided by domain experts and automatically labels unannotated data using the rules. Specifically, Rapid combines pre-trained CV models and inductive logic learning to infer the logic-based labeling rules. Rapid achieves a labeling accuracy of 83.33% to 88.33% on four image labeling tasks with only 12 to 39 labeled samples. In particular, Rapid significantly outperforms finetuned CV models in two highly specialized tasks. These results demonstrate the effectiveness of Rapid in learning from small data and its capability to generalize among different tasks. Code and our dataset are publicly available at https://github.com/Neural-Symbolic-Image-Labeling/ △ Less",https://arxiv.orghttps://arxiv.org/abs/2306.10490,June 2023
Iterative Hierarchy and Ranking Process (IHRP): A Novel Effective Hierarchy Method for Densely Connected Systems and Case Study in Student Performance Assessment,"Suvojit Dhara, Adrijit Goswami","In real-life decision-making problems, determining the influences of the factors on the decision attribute is one of the primary tasks. To affect the decision attribute most, finding a proper hierarchy among the factors and determining their importance values in the system becomes quite important. Interpretive structural modeling (ISM) is a widely used hierarchy-building method that mines factor inter-influences based on expert opinions. This paper discusses one of the main drawbacks of the conventional ISM method in systems where the factors are densely interrelated. We refer to such systems as ""dense systems"". We propose a novel iterative hierarchy-building technique, called 'Iterative Hierarchy and Ranking Process'(IHRP) which performs effectively in such dense systems. To take the vagueness of the expert opinions into account, intuitionistic fuzzy linguistics has been used in the research work. In this paper, we propose a two-stage calculation of the relative importance of the factors in the system based on their hierarchical positions and rank the factors accordingly. We have performed a case study on student performance assessment by taking up novel Indian high-school administrative factors' data collected by surveying the experts in this field. A comparative study has been conducted in terms of the correlation of the factor ranking achieved by the proposed method and conventional ISM method with that of standard outranking methods like TOPSIS, and VIKOR. Our proposed IHRP framework achieves an 85-95% correlation compared to a 50-60% correlation for the conventional ISM method. This proves the effectiveness of the proposed method in determining a better hierarchy than the conventional method, especially in dense systems. △ Less",https://arxiv.orghttps://arxiv.org/abs/2306.10409,June 2023
