Title,Authors,Abstract,URL,Submitted Date
Mining for Unknown Unknowns,Bernard Sinclair-Desgagné,"Unknown unknowns are future relevant contingencies that lack an ex ante description. While there are numerous retrospective accounts showing that significant gains or losses might have been achieved or avoided had such contingencies been previously uncovered, getting hold of unknown unknowns still remains elusive, both in practice and conceptually. Using Formal Concept Analysis (FCA) - a subfield of lattice theory which is increasingly applied for mining and organizing data - this paper introduces a simple framework to systematically think out of the box and direct the search for unknown unknowns. △ Less",https://arxiv.orghttps://arxiv.org/abs/2307.05071,July 2023
A physics-constrained machine learning method for mapping gapless land surface temperature,"Jun Ma, Huanfeng Shen, Menghui Jiang, Liupeng Lin, Chunlei Meng, Chao Zeng, Huifang Li, Penghai Wu","More accurate, spatio-temporally, and physically consistent LST estimation has been a main interest in Earth system research. Developing physics-driven mechanism models and data-driven machine learning (ML) models are two major paradigms for gapless LST estimation, which have their respective advantages and disadvantages. In this paper, a physics-constrained ML model, which combines the strengths in the mechanism model and ML model, is proposed to generate gapless LST with physical meanings and high accuracy. The hybrid model employs ML as the primary architecture, under which the input variable physical constraints are incorporated to enhance the interpretability and extrapolation ability of the model. Specifically, the light gradient-boosting machine (LGBM) model, which uses only remote sensing data as input, serves as the pure ML model. Physical constraints (PCs) are coupled by further incorporating key Community Land Model (CLM) forcing data (cause) and CLM simulation data (effect) as inputs into the LGBM model. This integration forms the PC-LGBM model, which incorporates surface energy balance (SEB) constraints underlying the data in CLM-LST modeling within a biophysical framework. Compared with a pure physical method and pure ML methods, the PC-LGBM model improves the prediction accuracy and physical interpretability of LST. It also demonstrates a good extrapolation ability for the responses to extreme weather cases, suggesting that the PC-LGBM model enables not only empirical learning from data but also rationally derived from theory. The proposed method represents an innovative way to map accurate and physically interpretable gapless LST, and could provide insights to accelerate knowledge discovery in land surface processes and data mining in geographical parameter estimation. △ Less",https://arxiv.orghttps://arxiv.org/abs/2307.04817,July 2023
Automatically detecting activities of daily living from in-home sensors as indicators of routine behaviour in an older population,"Claire M. Timon, Pamela Hussey, Hyowon Lee, Catriona Murphy, Harsh Vardan Rai, and Alan F. Smeaton","Objective: The NEX project has developed an integrated Internet of Things (IoT) system coupled with data analytics to offer unobtrusive health and wellness monitoring supporting older adults living independently at home. Monitoring {currently} involves visualising a set of automatically detected activities of daily living (ADLs) for each participant. The detection of ADLs is achieved {} to allow the incorporation of additional participants whose ADLs are detected without re-training the system. Methods: Following an extensive User Needs and Requirements study involving 426 participants, a pilot trial and a friendly trial of the deployment, an Action Research Cycle (ARC) trial was completed. This involved 23 participants over a 10-week period each with c.20 IoT sensors in their homes. During the ARC trial, participants each took part in two data-informed briefings which presented visualisations of their own in-home activities. The briefings also gathered training data on the accuracy of detected activities. Association rule mining was then used on the combination of data from sensors and participant feedback to improve the automatic detection of ADLs. Results: Association rule mining was used to detect a range of ADLs for each participant independently of others and was then used to detect ADLs across participants using a single set of rules {for each ADL}. This allows additional participants to be added without the necessity of them providing training data. Conclusions: Additional participants can be added to the NEX system without the necessity to re-train the system for automatic detection of the set of their activities of daily living. △ Less",https://arxiv.orghttps://arxiv.org/abs/2307.04563,July 2023
Learning Behavioral Representations of Routines From Large-scale Unlabeled Wearable Time-series Data Streams using Hawkes Point Process,"Tiantian Feng, Brandon M Booth, Shrikanth Narayanan","Continuously-worn wearable sensors enable researchers to collect copious amounts of rich bio-behavioral time series recordings of real-life activities of daily living, offering unprecedented opportunities to infer novel human behavior patterns during daily routines. Existing approaches to routine discovery through bio-behavioral data rely either on pre-defined notions of activities or use additional non-behavioral measurements as contexts, such as GPS location or localization within the home, presenting risks to user privacy. In this work, we propose a novel wearable time-series mining framework, Hawkes point process On Time series clusters for ROutine Discovery (HOT-ROD), for uncovering behavioral routines from completely unlabeled wearable recordings. We utilize a covariance-based method to generate time-series clusters and discover routines via the Hawkes point process learning algorithm. We empirically validate our approach for extracting routine behaviors using a completely unlabeled time-series collected continuously from over 100 individuals both in and outside of the workplace during a period of ten weeks. Furthermore, we demonstrate this approach intuitively captures daily transitional relationships between physical activity states without using prior knowledge. We also show that the learned behavioral patterns can assist in illuminating an individual's personality and affect. △ Less",https://arxiv.orghttps://arxiv.org/abs/2307.04445,July 2023
Social Media Analytics in Disaster Response: A Comprehensive Review,Mohammadsepehr Karimiziarani,"Social media has emerged as a valuable resource for disaster management, revolutionizing the way emergency response and recovery efforts are conducted during natural disasters. This review paper aims to provide a comprehensive analysis of social media analytics for disaster management. The abstract begins by highlighting the increasing prevalence of natural disasters and the need for effective strategies to mitigate their impact. It then emphasizes the growing influence of social media in disaster situations, discussing its role in disaster detection, situational awareness, and emergency communication. The abstract explores the challenges and opportunities associated with leveraging social media data for disaster management purposes. It examines methodologies and techniques used in social media analytics, including data collection, preprocessing, and analysis, with a focus on data mining and machine learning approaches. The abstract also presents a thorough examination of case studies and best practices that demonstrate the successful application of social media analytics in disaster response and recovery. Ethical considerations and privacy concerns related to the use of social media data in disaster scenarios are addressed. The abstract concludes by identifying future research directions and potential advancements in social media analytics for disaster management. The review paper aims to provide practitioners and researchers with a comprehensive understanding of the current state of social media analytics in disaster management, while highlighting the need for continued research and innovation in this field. △ Less",https://arxiv.orghttps://arxiv.org/abs/2307.04046,July 2023
CLIPMasterPrints: Fooling Contrastive Language-Image Pre-training Using Latent Variable Evolution,"Matthias Freiberger, Peter Kun, Anders Sundnes Løvlie, Sebastian Risi","Models leveraging both visual and textual data such as Contrastive Language-Image Pre-training (CLIP), are increasingly gaining importance. In this work, we show that despite their versatility, such models are vulnerable to what we refer to as fooling master images. Fooling master images are capable of maximizing the confidence score of a CLIP model for a significant number of widely varying prompts, while being unrecognizable for humans. We demonstrate how fooling master images can be mined by searching the latent space of generative models by means of an evolution strategy or stochastic gradient descent. We investigate the properties of the mined fooling master images, and find that images trained on a small number of image captions potentially generalize to a much larger number of semantically related captions. Further, we evaluate two possible mitigation strategies and find that vulnerability to fooling master examples is closely related to a modality gap in contrastive pre-trained multi-modal networks. From the perspective of vulnerability to off-manifold attacks, we therefore argue for the mitigation of modality gaps in CLIP and related multi-modal approaches. Source code and mined CLIPMasterPrints are available at https://github.com/matfrei/CLIPMasterPrints. △ Less",https://arxiv.orghttps://arxiv.org/abs/2307.03798,July 2023
GPT4RoI: Instruction Tuning Large Language Model on Region-of-Interest,"Shilong Zhang, Peize Sun, Shoufa Chen, Min Xiao, Wenqi Shao, Wenwei Zhang, Kai Chen, Ping Luo","Instruction tuning large language model (LLM) on image-text pairs has achieved unprecedented vision-language multimodal abilities. However, their vision-language alignments are only built on image-level, the lack of region-level alignment limits their advancements to fine-grained multimodal understanding. In this paper, we propose instruction tuning on region-of-interest. The key design is to reformulate the bounding box as the format of spatial instruction. The interleaved sequences of visual features extracted by the spatial instruction and the language embedding are input to LLM, and trained on the transformed region-text data in instruction tuning format. Our region-level vision-language model, termed as GPT4RoI, brings brand new conversational and interactive experience beyond image-level understanding. (1) Controllability: Users can interact with our model by both language and spatial instructions to flexibly adjust the detail level of the question. (2) Capacities: Our model supports not only single-region spatial instruction but also multi-region. This unlocks more region-level multimodal capacities such as detailed region caption and complex region reasoning. (3) Composition: Any off-the-shelf object detector can be a spatial instruction provider so as to mine informative object attributes from our model, like color, shape, material, action, relation to other objects, etc. The code, data, and demo can be found at https://github.com/jshilong/GPT4RoI. △ Less",https://arxiv.orghttps://arxiv.org/abs/2307.03601,July 2023
Structure Guided Multi-modal Pre-trained Transformer for Knowledge Graph Reasoning,"Ke Liang, Sihang Zhou, Yue Liu, Lingyuan Meng, Meng Liu, Xinwang Liu","Multimodal knowledge graphs (MKGs), which intuitively organize information in various modalities, can benefit multiple practical downstream tasks, such as recommendation systems, and visual question answering. However, most MKGs are still far from complete, which motivates the flourishing of MKG reasoning models. Recently, with the development of general artificial architectures, the pretrained transformer models have drawn increasing attention, especially for multimodal scenarios. However, the research of multimodal pretrained transformer (MPT) for knowledge graph reasoning (KGR) is still at an early stage. As the biggest difference between MKG and other multimodal data, the rich structural information underlying the MKG still cannot be fully leveraged in existing MPT models. Most of them only utilize the graph structure as a retrieval map for matching images and texts connected with the same entity. This manner hinders their reasoning performances. To this end, we propose the graph Structure Guided Multimodal Pretrained Transformer for knowledge graph reasoning, termed SGMPT. Specifically, the graph structure encoder is adopted for structural feature encoding. Then, a structure-guided fusion module with two different strategies, i.e., weighted summation and alignment constraint, is first designed to inject the structural information into both the textual and visual features. To the best of our knowledge, SGMPT is the first MPT model for multimodal KGR, which mines the structural information underlying the knowledge graph. Extensive experiments on FB15k-237-IMG and WN18-IMG, demonstrate that our SGMPT outperforms existing state-of-the-art models, and prove the effectiveness of the designed strategies. △ Less",https://arxiv.orghttps://arxiv.org/abs/2307.03591,July 2023
JSONoid: Monoid-based Enrichment for Configurable and Scalable Data-Driven Schema Discovery,Michael J. Mior,"Schema discovery is an important aspect to working with data in formats such as JSON. Unlike relational databases, JSON data sets often do not have associated structural information. Consumers of such datasets are often left to browse through data in an attempt to observe commonalities in structure across documents to construct suitable code for data processing. However, this process is time-consuming and error-prone. Existing distributed approaches to mining schemas present a significant usability advantage as they provide useful metadata for large data sources. However, depending on the data source, ad hoc queries for estimating other properties to help with crafting an efficient data pipeline can be expensive. We propose JSONoid, a distributed schema discovery process augmented with additional metadata in the form of monoid data structures that are easily maintainable in a distributed setting. JSONoid subsumes several existing approaches to distributed schema discovery with similar performance. Our approach also adds significant useful additional information about data values to discovered schemas with linear scalability. △ Less",https://arxiv.orghttps://arxiv.org/abs/2307.03113,July 2023
Applying Process Mining on Scientific Workflows: a Case Study,"Zahra Sadeghibogar, Alessandro Berti, Marco Pegoraro, Wil M. P. van der Aalst","Computer-based scientific experiments are becoming increasingly data-intensive. High-Performance Computing (HPC) clusters are ideal for executing large scientific experiment workflows. Executing large scientific workflows in an HPC cluster leads to complex flows of data and control within the system, which are difficult to analyze. This paper presents a case study where process mining is applied to logs extracted from SLURM-based HPC clusters, in order to document the running workflows and find the performance bottlenecks. The challenge lies in correlating the jobs recorded in the system to enable the application of mainstream process mining techniques. Users may submit jobs with explicit or implicit interdependencies, leading to the consideration of different event correlation techniques. We present a log extraction technique from SLURM clusters, completed with an experimental. △ Less",https://arxiv.orghttps://arxiv.org/abs/2307.02833,July 2023
CPDG: A Contrastive Pre-Training Method for Dynamic Graph Neural Networks,"Yuanchen Bei, Hao Xu, Sheng Zhou, Huixuan Chi, Mengdi Zhang, Zhao Li, Jiajun Bu","Dynamic graph data mining has gained popularity in recent years due to the rich information contained in dynamic graphs and their widespread use in the real world. Despite the advances in dynamic graph neural networks (DGNNs), the rich information and diverse downstream tasks have posed significant difficulties for the practical application of DGNNs in industrial scenarios. To this end, in this paper, we propose to address them by pre-training and present the Contrastive Pre-Training Method for Dynamic Graph Neural Networks (CPDG). CPDG tackles the challenges of pre-training for DGNNs, including generalization and long-short term modeling capability, through a flexible structural-temporal subgraph sampler along with structural-temporal contrastive pre-training schemes. Extensive experiments conducted on both large-scale research and industrial dynamic graph datasets show that CPDG outperforms existing methods in dynamic graph pre-training for various downstream tasks under three transfer settings. △ Less",https://arxiv.orghttps://arxiv.org/abs/2307.02813,July 2023
Real-time Workload Pattern Analysis for Large-scale Cloud Databases,"Jiaqi Wang, Tianyi Li, Anni Wang, Xiaoze Liu, Lu Chen, Jie Chen, Jianye Liu, Junyang Wu, Feifei Li, Yunjun Gao","Hosting database services on cloud systems has become a common practice. This has led to the increasing volume of database workloads, which provides the opportunity for pattern analysis. Discovering workload patterns from a business logic perspective is conducive to better understanding the trends and characteristics of the database system. However, existing workload pattern discovery systems are not suitable for large-scale cloud databases which are commonly employed by the industry. This is because the workload patterns of large-scale cloud databases are generally far more complicated than those of ordinary databases. In this paper, we propose Alibaba Workload Miner (AWM), a real-time system for discovering workload patterns in complicated large-scale workloads. AWM encodes and discovers the SQL query patterns logged from user requests and optimizes the querying processing based on the discovered patterns. First, Data Collection & Preprocessing Module collects streaming query logs and encodes them into high-dimensional feature embeddings with rich semantic contexts and execution features. Next, Online Workload Mining Module separates encoded queries by business groups and discovers the workload patterns for each group. Meanwhile, Offline Training Module collects labels and trains the classification model using the labels. Finally, Pattern-based Optimizing Module optimizes query processing in cloud databases by exploiting discovered patterns. Extensive experimental results on one synthetic dataset and two real-life datasets (extracted from Alibaba Cloud databases) show that AWM enhances the accuracy of pattern discovery by 66% and reduce the latency of online inference by 22%, compared with the state-of-the-arts. △ Less",https://arxiv.orghttps://arxiv.org/abs/2307.02626,July 2023
Towards Open Federated Learning Platforms: Survey and Vision from Technical and Legal Perspectives,Moming Duan,"Traditional Federated Learning (FL) follows a server-domincated cooperation paradigm which narrows the application scenarios of FL and decreases the enthusiasm of data holders to participate. To fully unleash the potential of FL, we advocate rethinking the design of current FL frameworks and extending it to a more generalized concept: Open Federated Learning Platforms. We propose two reciprocal cooperation frameworks for FL to achieve this: query-based FL and contract-based FL. In this survey, we conduct a comprehensive review of the feasibility of constructing an open FL platform from both technical and legal perspectives. We begin by reviewing the definition of FL and summarizing its inherent limitations, including server-client coupling, low model reusability, and non-public. In the query-based FL platform, which is an open model sharing and reusing platform empowered by the community for model mining, we explore a wide range of valuable topics, including the availability of up-to-date model repositories for model querying, legal compliance analysis between different model licenses, and copyright issues and intellectual property protection in model reusing. In particular, we introduce a novel taxonomy to streamline the analysis of model license compatibility in FL studies that involve batch model reusing methods, including combination, amalgamation, distillation, and generation. This taxonomy provides a systematic framework for identifying the corresponding clauses of licenses and facilitates the identification of potential legal implications and restrictions when reusing models. Through this survey, we uncover the the current dilemmas faced by FL and advocate for the development of sustainable open FL platforms. We aim to provide guidance for establishing such platforms in the future, while identifying potential problems and challenges that need to be addressed. △ Less",https://arxiv.orghttps://arxiv.org/abs/2307.02140,July 2023
LØ: An Accountable Mempool for MEV Resistance,"Bulat Nasrulin, Georgy Ishmaev, Jérémie Decouchant, Johan Pouwelse","Possible manipulation of user transactions by miners in a permissionless blockchain systems is a growing concern. This problem is a pervasive and systemic issue, known as Miner Extractable Value (MEV), incurs highs costs on users of decentralised applications. Furthermore, transaction manipulations create other issues in blockchain systems such as congestion, higher fees, and system instability. Detecting transaction manipulations is difficult, even though it is known that they originate from the pre-consensus phase of transaction selection for a block building, at the base layer of blockchain protocols. In this paper we summarize known transaction manipulation attacks. We then present LØ, an accountable base layer protocol specifically designed to detect and mitigate transaction manipulations. LØ is built around accurate detection of transaction manipulations and assignment of blame at the granularity of a single mining node. LØ forces miners to log all the transactions they receive into a secure mempool data structure and to process them in a verifiable manner. Overall, LØ quickly and efficiently detects reordering, injection or censorship attempts. Our performance evaluation shows that LØ is also practical and only introduces a marginal performance overhead. △ Less",https://arxiv.orghttps://arxiv.org/abs/2307.02081,July 2023
Vibronic fine structure in the nitrogen 1s photoelectron spectra from Franck-Condon simulations II: Indoles,"Minrui Wei, Lu Zhang, Guangjun Tian, Weijie Hua","The vibronic coupling effect in nitrogen 1s X-ray photoelectron spectra (XPS) was systematically studied for a family of 17 bicyclic indole molecules by combining Franck-Condon simulations (including the Duschinsky rotation effect) and density functional theory. The simulated vibrationally-resolved spectra of 4 molecules agree well with available experiments. Reliable predictions for this family further allowed us to summarize rules for spectral evolution in response to three types of common structural changes (side chain substitution, CH$\leftrightarrow$N replacement, and isomerization). Interestingly, vibronic properties of amine and imine nitrogen are clearly separated: they show negative and positive $Δ$ZPE (zero-point vibration energy of the core-ionized with respect to the ground state), respectively, indicating flatter and steeper PESs induced by the N 1s ionization; amine N's show stronger mode mixing effects than imine N's; the 1s ionizations on two types of nitrogens led to distinct changes in local bond lengths and angles. The rules are useful for a basic understanding of vibronic coupling in this family, and the precise spectra are useful for future reference and data mining studies. △ Less",https://arxiv.orghttps://arxiv.org/abs/2307.01510,July 2023
Spatio-Temporal Surrogates for Interaction of a Jet with High Explosives: Part II -- Clustering Extremely High-Dimensional Grid-Based Data,"Chandrika Kamath, Juliette S. Franzman","Building an accurate surrogate model for the spatio-temporal outputs of a computer simulation is a challenging task. A simple approach to improve the accuracy of the surrogate is to cluster the outputs based on similarity and build a separate surrogate model for each cluster. This clustering is relatively straightforward when the output at each time step is of moderate size. However, when the spatial domain is represented by a large number of grid points, numbering in the millions, the clustering of the data becomes more challenging. In this report, we consider output data from simulations of a jet interacting with high explosives. These data are available on spatial domains of different sizes, at grid points that vary in their spatial coordinates, and in a format that distributes the output across multiple files at each time step of the simulation. We first describe how we bring these data into a consistent format prior to clustering. Borrowing the idea of random projections from data mining, we reduce the dimension of our data by a factor of thousand, making it possible to use the iterative k-means method for clustering. We show how we can use the randomness of both the random projections, and the choice of initial centroids in k-means clustering, to determine the number of clusters in our data set. Our approach makes clustering of extremely high dimensional data tractable, generating meaningful cluster assignments for our problem, despite the approximation introduced in the random projections. △ Less",https://arxiv.orghttps://arxiv.org/abs/2307.01400,July 2023
