Title,Authors,Abstract,URL,Submitted Date
Differential Privacy with Random Projections and Sign Random Projections,"Ping Li, Xiaoyun Li","In this paper, we develop a series of differential privacy (DP) algorithms from a family of random projections (RP) for general applications in machine learning, data mining, and information retrieval. Among the presented algorithms, iDP-SignRP is remarkably effective under the setting of ``individual differential privacy'' (iDP), based on sign random projections (SignRP). Also, DP-SignOPORP considerably improves existing algorithms in the literature under the standard DP setting, using ``one permutation + one random projection'' (OPORP), where OPORP is a variant of the celebrated count-sketch method with fixed-length binning and normalization. Without taking signs, among the DP-RP family, DP-OPORP achieves the best performance. Our key idea for improving DP-RP is to take only the signs, i.e., $sign(x_j) = sign\left(\sum_{i=1}^p u_i w_{ij}\right)$, of the projected data. The intuition is that the signs often remain unchanged when the original data ($u$) exhibit small changes (according to the ``neighbor'' definition in DP). In other words, the aggregation and quantization operations themselves provide good privacy protections. We develop a technique called ``smooth flipping probability'' that incorporates this intuitive privacy benefit of SignRPs and improves the standard DP bit flipping strategy. Based on this technique, we propose DP-SignOPORP which satisfies strict DP and outperforms other DP variants based on SignRP (and RP), especially when $ε$ is not very large (e.g., $ε= 5\sim10$). Moreover, if an application scenario accepts individual DP, then we immediately obtain an algorithm named iDP-SignRP which achieves excellent utilities even at small~$ε$ (e.g., $ε<0.5$). △ Less",https://arxiv.orghttps://arxiv.org/abs/2306.01751,June 2023
Prompt Tuning Large Language Models on Personalized Aspect Extraction for Recommendations,"Pan Li, Yuyan Wang, Ed H. Chi, Minmin Chen","Existing aspect extraction methods mostly rely on explicit or ground truth aspect information, or using data mining or machine learning approaches to extract aspects from implicit user feedback such as user reviews. It however remains under-explored how the extracted aspects can help generate more meaningful recommendations to the users. Meanwhile, existing research on aspect-based recommendations often relies on separate aspect extraction models or assumes the aspects are given, without accounting for the fact the optimal set of aspects could be dependent on the recommendation task at hand. In this work, we propose to combine aspect extraction together with aspect-based recommendations in an end-to-end manner, achieving the two goals together in a single framework. For the aspect extraction component, we leverage the recent advances in large language models and design a new prompt learning mechanism to generate aspects for the end recommendation task. For the aspect-based recommendation component, the extracted aspects are concatenated with the usual user and item features used by the recommendation model. The recommendation task mediates the learning of the user embeddings and item embeddings, which are used as soft prompts to generate aspects. Therefore, the extracted aspects are personalized and contextualized by the recommendation task. We showcase the effectiveness of our proposed method through extensive experiments on three industrial datasets, where our proposed framework significantly outperforms state-of-the-art baselines in both the personalized aspect extraction and aspect-based recommendation tasks. In particular, we demonstrate that it is necessary and beneficial to combine the learning of aspect extraction and aspect-based recommendation together. We also conduct extensive ablation studies to understand the contribution of each design component in our framework. △ Less",https://arxiv.orghttps://arxiv.org/abs/2306.01475,June 2023
Introduction of Medical Imaging Modalities,"S. K. M Shadekul Islam, MD Abdullah Al Nasim, Ismail Hossain, Dr. Md Azim Ullah, Dr. Kishor Datta Gupta, Md Monjur Hossain Bhuiyan","The diagnosis and treatment of various diseases had been expedited with the help of medical imaging. Different medical imaging modalities, including X-ray, Computed Tomography (CT), Magnetic Resonance Imaging (MRI), Nuclear Imaging, Ultrasound, Electrical Impedance Tomography (EIT), and Emerging Technologies for in vivo imaging modalities is presented in this chapter, in addition to these modalities, some advanced techniques such as contrast-enhanced MRI, MR approaches for osteoarthritis, Cardiovascular Imaging, and Medical Imaging data mining and search. Despite its important role and potential effectiveness as a diagnostic tool, reading and interpreting medical images by radiologists is often tedious and difficult due to the large heterogeneity of diseases and the limitation of image quality or resolution. Besides the introduction and discussion of the basic principles, typical clinical applications, advantages, and limitations of each modality used in current clinical practice, this chapter also highlights the importance of emerging technologies in medical imaging and the role of data mining and search aiming to support translational clinical research, improve patient care, and increase the efficiency of the healthcare system. △ Less",https://arxiv.orghttps://arxiv.org/abs/2306.01022,June 2023
Modeling and Analyzing Scorer Preferences in Short-Answer Math Questions,"Mengxue Zhang, Neil Heffernan, Andrew Lan","Automated scoring of student responses to open-ended questions, including short-answer questions, has great potential to scale to a large number of responses. Recent approaches for automated scoring rely on supervised learning, i.e., training classifiers or fine-tuning language models on a small number of responses with human-provided score labels. However, since scoring is a subjective process, these human scores are noisy and can be highly variable, depending on the scorer. In this paper, we investigate a collection of models that account for the individual preferences and tendencies of each human scorer in the automated scoring task. We apply these models to a short-answer math response dataset where each response is scored (often differently) by multiple different human scorers. We conduct quantitative experiments to show that our scorer models lead to improved automated scoring accuracy. We also conduct quantitative experiments and case studies to analyze the individual preferences and tendencies of scorers. We found that scorers can be grouped into several obvious clusters, with each cluster having distinct features, and analyzed them in detail. △ Less",https://arxiv.orghttps://arxiv.org/abs/2306.00791,June 2023
UNGOML: Automated Classification of unsafe Usages in Go,"Anna-Katharina Wickert, Clemens Damke, Lars Baumgärtner, Eyke Hüllermeier, Mira Mezini","The Go programming language offers strong protection from memory corruption. As an escape hatch of these protections, it provides the unsafe package. Previous studies identified that this unsafe package is frequently used in real-world code for several purposes, e.g., serialization or casting types. Due to the variety of these reasons, it may be possible to refactor specific usages to avoid potential vulnerabilities. However, the classification of unsafe usages is challenging and requires the context of the call and the program's structure. In this paper, we present the first automated classifier for unsafe usages in Go, UNGOML, to identify what is done with the unsafe package and why it is used. For UNGOML, we built four custom deep learning classifiers trained on a manually labeled data set. We represent Go code as enriched control-flow graphs (CFGs) and solve the label prediction task with one single-vertex and three context-aware classifiers. All three context-aware classifiers achieve a top-1 accuracy of more than 86% for both dimensions, WHAT and WHY. Furthermore, in a set-valued conformal prediction setting, we achieve accuracies of more than 93% with mean label set sizes of 2 for both dimensions. Thus, UNGOML can be used to efficiently filter unsafe usages for use cases such as refactoring or a security audit. UNGOML: https://github.com/stg-tud/ungoml Artifact: https://dx.doi.org/10.6084/m9.figshare.22293052 △ Less",https://arxiv.orghttps://arxiv.org/abs/2306.00694,June 2023
Representation Theorems Obtained by Miningacross Web Sources for Hints,"Marco B. Caminati, Juliana K. F. Bowles","A representation theorem relates different mathematical structures by providing an isomorphism between them: that is, a one-to-one correspondence preserving their original properties. Establishing that the two structures substantially behave in the same way, representation theorems typically provide insight and generate powerful techniques to study the involved structures, by cross-fertilising between the methodologies existing for each of the respective branches of mathematics. When the related structures have no obvious a priori connection, however, such results can be, by their own nature, elusive. Here, we show how data-mining across distinct web sources (including the Online Encyclopedia of Integer Sequences, OEIS), was crucial in the discovery of two original representation theorems relating event structures (mathematical structures commonly used to represent concurrent discrete systems) to families of sets (endowed with elementary disjointness and subset relations) and to full graphs, respectively. The latter originally emerged in the apparently unrelated field of bioinformatics. As expected, our representation theorems are powerful, allowing to capitalise on existing theorems about full graphs to immediately conclude new facts about event structures. Our contribution is twofold: on one hand, we illustrate our novel method to mine the web, resulting in thousands of candidate connections between distinct mathematical realms; on the other hand, we explore one of these connections to obtain our new representation theorems. We hope this paper can encourage people with relevant expertise to scrutinize these candidate connections. We anticipate that, building on the ideas presented here, further connections can be unearthed, by refining the mining techniques and by extending the mined repositories. △ Less",https://arxiv.orghttps://arxiv.org/abs/2306.00584,June 2023
Example-based Motion Synthesis via Generative Motion Matching,"Weiyu Li, Xuelin Chen, Peizhuo Li, Olga Sorkine-Hornung, Baoquan Chen","We present GenMM, a generative model that ""mines"" as many diverse motions as possible from a single or few example sequences. In stark contrast to existing data-driven methods, which typically require long offline training time, are prone to visual artifacts, and tend to fail on large and complex skeletons, GenMM inherits the training-free nature and the superior quality of the well-known Motion Matching method. GenMM can synthesize a high-quality motion within a fraction of a second, even with highly complex and large skeletal structures. At the heart of our generative framework lies the generative motion matching module, which utilizes the bidirectional visual similarity as a generative cost function to motion matching, and operates in a multi-stage framework to progressively refine a random guess using exemplar motion matches. In addition to diverse motion generation, we show the versatility of our generative framework by extending it to a number of scenarios that are not possible with motion matching alone, including motion completion, key frame-guided generation, infinite looping, and motion reassembly. Code and data for this paper are at https://wyysf-98.github.io/GenMM/ △ Less",https://arxiv.orghttps://arxiv.org/abs/2306.00378,June 2023
Explicit Feature Interaction-aware Uplift Network for Online Marketing,"Dugang Liu, Xing Tang, Han Gao, Fuyuan Lyu, Xiuqiang He","As a key component in online marketing, uplift modeling aims to accurately capture the degree to which different treatments motivate different users, such as coupons or discounts, also known as the estimation of individual treatment effect (ITE). In an actual business scenario, the options for treatment may be numerous and complex, and there may be correlations between different treatments. In addition, each marketing instance may also have rich user and contextual features. However, existing methods still fall short in both fully exploiting treatment information and mining features that are sensitive to a particular treatment. In this paper, we propose an explicit feature interaction-aware uplift network (EFIN) to address these two problems. Our EFIN includes four customized modules: 1) a feature encoding module encodes not only the user and contextual features, but also the treatment features; 2) a self-interaction module aims to accurately model the user's natural response with all but the treatment features; 3) a treatment-aware interaction module accurately models the degree to which a particular treatment motivates a user through interactions between the treatment features and other features, i.e., ITE; and 4) an intervention constraint module is used to balance the ITE distribution of users between the control and treatment groups so that the model would still achieve a accurate uplift ranking on data collected from a non-random intervention marketing scenario. We conduct extensive experiments on two public datasets and one product dataset to verify the effectiveness of our EFIN. In addition, our EFIN has been deployed in a credit card bill payment scenario of a large online financial platform with a significant improvement. △ Less",https://arxiv.orghttps://arxiv.org/abs/2306.00315,June 2023
Broadband VLA Spectral Line Survey of a Sample of Ionized Jet Candidates,"E. Sanchez-Tovar, E. D. Araya, V. Rosero, P. Hofner, S. Kurtz","The study of the interaction between ionized jets, molecular outflows and their environments is critical to understanding high-mass star formation, especially because jets and outflows are thought to be key in the transfer of angular momentum outwards from accretion disks. We report a low-spectral resolution VLA survey for hydrogen radio recombination lines, OH, NH$_3$, and CH$_3$OH lines toward a sample of 58 high-mass star forming regions that contain numerous ionized jet candidates. The observations are from a survey designed to detect radio continuum; the novel aspect of this work is to search for spectral lines in broadband VLA data (we provide the script developed in this work to facilitate exploration of other datasets). We report detection of 25$\,$GHz CH$_3$OH transitions toward ten sources; five of them also show NH$_3$ emission. We found that most of the sources detected in CH$_3$OH and NH$_3$ have been classified as ionized jets or jet candidates and that the emission lines are coincident with, or very near ($\lesssim 0.1$ pc) these sources, hence, these molecular lines could be used as probes of the environment near the launching site of jets/outflows. No radio recombination lines were detected, but we found that the RMS noise of stacked spectra decreases following the radiometer equation. Therefore, detecting radio recombination lines in a sample of brighter free-free continuum sources should be possible. This work demonstrates the potential of broadband VLA continuum observations as low-resolution spectral line scans. △ Less",https://arxiv.orghttps://arxiv.org/abs/2306.00111,June 2023
A Survey of Potential MPI Complex Collectives: Large-Scale Mining and Analysis of HPC Applications,"Pouya Haghi, Ryan Marshall, Po Hao Chen, Anthony Skjellum, Martin Herbordt","Offload of MPI collectives to network devices, e.g., NICs and switches, is being implemented as an effective mechanism to improve application performance by reducing inter- and intra-node communication and bypassing MPI software layers. Given the rich deployment of accelerators and programmable NICs/switches in data centers, we posit that there is an opportunity to further improve performance by extending this idea (of in-network collective processing) to a new class of more complex collectives. The most basic type of complex collective is the fusion of existing collectives. In previous work we have demonstrated the efficacy of this additional hardware and software support and shown that it can substantially improve the performance of certain applications. In this work we extend this approach. We seek to characterize a large number of MPI applications to determine overall applicability, both breadth and type, and so provide insight for hardware designers and MPI developers about future offload possibilities. Besides increasing the scope of prior surveys to include finding (potential) new MPI constructs, we also tap into new methods to extend the survey process. Prior surveys on MPI usage considered lists of applications constructed based on application developers' knowledge. The approach taken in this paper, however, is based on an automated mining of a large collection of code sources. More specifically, the mining is accomplished by GitHub REST APIs. We use a database management system to store the results and to answer queries. Another advantage is that this approach provides support for a more complex analysis of MPI usage, which is accomplished by user queries. △ Less",https://arxiv.orghttps://arxiv.org/abs/2305.19946,May 2023
Fully Dynamic Submodular Maximization over Matroids,"Paul Dütting, Federico Fusco, Silvio Lattanzi, Ashkan Norouzi-Fard, Morteza Zadimoghaddam","Maximizing monotone submodular functions under a matroid constraint is a classic algorithmic problem with multiple applications in data mining and machine learning. We study this classic problem in the fully dynamic setting, where elements can be both inserted and deleted in real-time. Our main result is a randomized algorithm that maintains an efficient data structure with an $\tilde{O}(k^2)$ amortized update time (in the number of additions and deletions) and yields a $4$-approximate solution, where $k$ is the rank of the matroid. △ Less",https://arxiv.orghttps://arxiv.org/abs/2305.19918,May 2023
Large language models improve Alzheimer's disease diagnosis using multi-modality data,"Yingjie Feng, Jun Wang, Xianfeng Gu, Xiaoyin Xu, Min Zhang","In diagnosing challenging conditions such as Alzheimer's disease (AD), imaging is an important reference. Non-imaging patient data such as patient information, genetic data, medication information, cognitive and memory tests also play a very important role in diagnosis. Effect. However, limited by the ability of artificial intelligence models to mine such information, most of the existing models only use multi-modal image data, and cannot make full use of non-image data. We use a currently very popular pre-trained large language model (LLM) to enhance the model's ability to utilize non-image data, and achieved SOTA results on the ADNI dataset. △ Less",https://arxiv.orghttps://arxiv.org/abs/2305.19280,May 2023
FakeSwarm: Improving Fake News Detection with Swarming Characteristics,"Jun Wu, Xuesong Ye","The proliferation of fake news poses a serious threat to society, as it can misinform and manipulate the public, erode trust in institutions, and undermine democratic processes. To address this issue, we present FakeSwarm, a fake news identification system that leverages the swarming characteristics of fake news. To extract the swarm behavior, we propose a novel concept of fake news swarming characteristics and design three types of swarm features, including principal component analysis, metric representation, and position encoding. We evaluate our system on a public dataset and demonstrate the effectiveness of incorporating swarm features in fake news identification, achieving an f1-score and accuracy of over 97% by combining all three types of swarm features. Furthermore, we design an online learning pipeline based on the hypothesis of the temporal distribution pattern of fake news emergence, validated on a topic with early emerging fake news and a shortage of text samples, showing that swarm features can significantly improve recall rates in such cases. Our work provides a new perspective and approach to fake news detection and highlights the importance of considering swarming characteristics in detecting fake news. △ Less",https://arxiv.orghttps://arxiv.org/abs/2305.19194,May 2023
PyPOTS: A Python Toolbox for Data Mining on Partially-Observed Time Series,Wenjie Du,"PyPOTS is an open-source Python library dedicated to data mining and analysis on multivariate partially-observed time series, i.e. incomplete time series with missing values, A.K.A. irregularlysampled time series. Particularly, it provides easy access to diverse algorithms categorized into four tasks: imputation, classification, clustering, and forecasting. The included models contain probabilistic approaches as well as neural-network methods, with a well-designed and fully-documented programming interface for both academic researchers and industrial professionals to use. With robustness and scalability in its design philosophy, best practices of software construction, for example, unit testing, continuous integration (CI) and continuous delivery (CD), code coverage, maintainability evaluation, interactive tutorials, and parallelization, are carried out as principles during the development of PyPOTS. The toolkit is available on both Python Package Index (PyPI) and Anaconda. PyPOTS is open-source and publicly available on GitHub https://github.com/WenjieDu/PyPOTS. △ Less",https://arxiv.orghttps://arxiv.org/abs/2305.18811,May 2023
Fast and Accurate Dual-Way Streaming PARAFAC2 for Irregular Tensors -- Algorithm and Application,"Jun-Gi Jang, Jeongyoung Lee, Yong-chan Park, U Kang","How can we efficiently and accurately analyze an irregular tensor in a dual-way streaming setting where the sizes of two dimensions of the tensor increase over time? What types of anomalies are there in the dual-way streaming setting? An irregular tensor is a collection of matrices whose column lengths are the same while their row lengths are different. In a dual-way streaming setting, both new rows of existing matrices and new matrices arrive over time. PARAFAC2 decomposition is a crucial tool for analyzing irregular tensors. Although real-time analysis is necessary in the dual-way streaming, static PARAFAC2 decomposition methods fail to efficiently work in this setting since they perform PARAFAC2 decomposition for accumulated tensors whenever new data arrive. Existing streaming PARAFAC2 decomposition methods work in a limited setting and fail to handle new rows of matrices efficiently. In this paper, we propose Dash, an efficient and accurate PARAFAC2 decomposition method working in the dual-way streaming setting. When new data are given, Dash efficiently performs PARAFAC2 decomposition by carefully dividing the terms related to old and new data and avoiding naive computations involved with old data. Furthermore, applying a forgetting factor makes Dash follow recent movements. Extensive experiments show that Dash achieves up to 14.0x faster speed than existing PARAFAC2 decomposition methods for newly arrived data. We also provide discoveries for detecting anomalies in real-world datasets, including Subprime Mortgage Crisis and COVID-19. △ Less",https://arxiv.orghttps://arxiv.org/abs/2305.18376,May 2023
Pure Spectral Graph Embeddings: Reinterpreting Graph Convolution for Top-N Recommendation,"Edoardo D'Amico, Aonghus Lawlor, Neil Hurley","The use of graph convolution in the development of recommender system algorithms has recently achieved state-of-the-art results in the collaborative filtering task (CF). While it has been demonstrated that the graph convolution operation is connected to a filtering operation on the graph spectral domain, the theoretical rationale for why this leads to higher performance on the collaborative filtering problem remains unknown. The presented work makes two contributions. First, we investigate the effect of using graph convolution throughout the user and item representation learning processes, demonstrating how the latent features learned are pushed from the filtering operation into the subspace spanned by the eigenvectors associated with the highest eigenvalues of the normalised adjacency matrix, and how vectors lying on this subspace are the optimal solutions for an objective function related to the sum of the prediction function over the training data. Then, we present an approach that directly leverages the eigenvectors to emulate the solution obtained through graph convolution, eliminating the requirement for a time-consuming gradient descent training procedure while also delivering higher performance on three real-world datasets. △ Less",https://arxiv.orghttps://arxiv.org/abs/2305.18374,May 2023
