Title,Authors,Abstract,URL,Submitted Date
Faster Parallel Exact Density Peaks Clustering,"Yihao Huang, Shangdi Yu, Julian Shun","Clustering multidimensional points is a fundamental data mining task, with applications in many fields, such as astronomy, neuroscience, bioinformatics, and computer vision. The goal of clustering algorithms is to group similar objects together. Density-based clustering is a clustering approach that defines clusters as dense regions of points. It has the advantage of being able to detect clusters of arbitrary shapes, rendering it useful in many applications. In this paper, we propose fast parallel algorithms for Density Peaks Clustering (DPC), a popular version of density-based clustering. Existing exact DPC algorithms suffer from low parallelism both in theory and in practice, which limits their application to large-scale data sets. Our most performant algorithm, which is based on priority search kd-trees, achieves $O(\log n\log\log n)$ span (parallel time complexity) for a data set of $n$ points. Our algorithm is also work-efficient, achieving a work complexity matching the best existing sequential exact DPC algorithm. In addition, we present another DPC algorithm based on a Fenwick tree that makes fewer assumptions for its average-case complexity to hold. We provide optimized implementations of our algorithms and evaluate their performance via extensive experiments. On a 30-core machine with two-way hyperthreading, we find that our best algorithm achieves a 10.8--13169x speedup over the previous best parallel exact DPC algorithm. Compared to the state-of-the-art parallel approximate DPC algorithm, our best algorithm achieves a 1.5--4206x speedup, while being exact. △ Less",https://arxiv.orghttps://arxiv.org/abs/2305.11335,May 2023
ORKG-Leaderboards: A Systematic Workflow for Mining Leaderboards as a Knowledge Graph,"Salomon Kabongo, Jennifer D'Souza, Sören Auer","The purpose of this work is to describe the Orkg-Leaderboard software designed to extract leaderboards defined as Task-Dataset-Metric tuples automatically from large collections of empirical research papers in Artificial Intelligence (AI). The software can support both the main workflows of scholarly publishing, viz. as LaTeX files or as PDF files. Furthermore, the system is integrated with the Open Research Knowledge Graph (ORKG) platform, which fosters the machine-actionable publishing of scholarly findings. Thus the system output, when integrated within the ORKG's supported Semantic Web infrastructure of representing machine-actionable 'resources' on the Web, enables: 1) broadly, the integration of empirical results of researchers across the world, thus enabling transparency in empirical research with the potential to also being complete contingent on the underlying data source(s) of publications; and 2) specifically, enables researchers to track the progress in AI with an overview of the state-of-the-art (SOTA) across the most common AI tasks and their corresponding datasets via dynamic ORKG frontend views leveraging tables and visualization charts over the machine-actionable data. Our best model achieves performances above 90% F1 on the \textit{leaderboard} extraction task, thus proving Orkg-Leaderboards a practically viable tool for real-world usage. Going forward, in a sense, Orkg-Leaderboards transforms the leaderboard extraction task to an automated digitalization task, which has been, for a long time in the community, a crowdsourced endeavor. △ Less",https://arxiv.orghttps://arxiv.org/abs/2305.11068,May 2023
BERM: Training the Balanced and Extractable Representation for Matching to Improve Generalization Ability of Dense Retrieval,"Shicheng Xu, Liang Pang, Huawei Shen, Xueqi Cheng","Dense retrieval has shown promise in the first-stage retrieval process when trained on in-domain labeled datasets. However, previous studies have found that dense retrieval is hard to generalize to unseen domains due to its weak modeling of domain-invariant and interpretable feature (i.e., matching signal between two texts, which is the essence of information retrieval). In this paper, we propose a novel method to improve the generalization of dense retrieval via capturing matching signal called BERM. Fully fine-grained expression and query-oriented saliency are two properties of the matching signal. Thus, in BERM, a single passage is segmented into multiple units and two unit-level requirements are proposed for representation as the constraint in training to obtain the effective matching signal. One is semantic unit balance and the other is essential matching unit extractability. Unit-level view and balanced semantics make representation express the text in a fine-grained manner. Essential matching unit extractability makes passage representation sensitive to the given query to extract the pure matching information from the passage containing complex context. Experiments on BEIR show that our method can be effectively combined with different dense retrieval training methods (vanilla, hard negatives mining and knowledge distillation) to improve its generalization ability without any additional inference overhead and target domain data. △ Less",https://arxiv.orghttps://arxiv.org/abs/2305.11052,May 2023
OpenShape: Scaling Up 3D Shape Representation Towards Open-World Understanding,"Minghua Liu, Ruoxi Shi, Kaiming Kuang, Yinhao Zhu, Xuanlin Li, Shizhong Han, Hong Cai, Fatih Porikli, Hao Su","We introduce OpenShape, a method for learning multi-modal joint representations of text, image, and point clouds. We adopt the commonly used multi-modal contrastive learning framework for representation alignment, but with a specific focus on scaling up 3D representations to enable open-world 3D shape understanding. To achieve this, we scale up training data by ensembling multiple 3D datasets and propose several strategies to automatically filter and enrich noisy text descriptions. We also explore and compare strategies for scaling 3D backbone networks and introduce a novel hard negative mining module for more efficient training. We evaluate OpenShape on zero-shot 3D classification benchmarks and demonstrate its superior capabilities for open-world recognition. Specifically, OpenShape achieves a zero-shot accuracy of 46.8% on the 1,156-category Objaverse-LVIS benchmark, compared to less than 10% for existing methods. OpenShape also achieves an accuracy of 85.3% on ModelNet40, outperforming previous zero-shot baseline methods by 20% and performing on par with some fully-supervised methods. Furthermore, we show that our learned embeddings encode a wide range of visual and semantic concepts (e.g., subcategories, color, shape, style) and facilitate fine-grained text-3D and image-3D interactions. Due to their alignment with CLIP embeddings, our learned shape representations can also be integrated with off-the-shelf CLIP-based models for various applications, such as point cloud captioning and point cloud-conditioned image generation. △ Less",https://arxiv.orghttps://arxiv.org/abs/2305.10764,May 2023
A Survey on Time-Series Pre-Trained Models,"Qianli Ma, Zhen Liu, Zhenjing Zheng, Ziyang Huang, Siying Zhu, Zhongzhong Yu, James T. Kwok","Time-Series Mining (TSM) is an important research area since it shows great potential in practical applications. Deep learning models that rely on massive labeled data have been utilized for TSM successfully. However, constructing a large-scale well-labeled dataset is difficult due to data annotation costs. Recently, Pre-Trained Models have gradually attracted attention in the time series domain due to their remarkable performance in computer vision and natural language processing. In this survey, we provide a comprehensive review of Time-Series Pre-Trained Models (TS-PTMs), aiming to guide the understanding, applying, and studying TS-PTMs. Specifically, we first briefly introduce the typical deep learning models employed in TSM. Then, we give an overview of TS-PTMs according to the pre-training techniques. The main categories we explore include supervised, unsupervised, and self-supervised TS-PTMs. Further, extensive experiments are conducted to analyze the advantages and disadvantages of transfer learning strategies, Transformer-based models, and representative TS-PTMs. Finally, we point out some potential directions of TS-PTMs for future work. △ Less",https://arxiv.orghttps://arxiv.org/abs/2305.10716,May 2023
Iteratively Learning Representations for Unseen Entities with Inter-Rule Correlations,"Zihan Wang, Kai Zhao, Yongquan He, Zhumin Chen, Pengjie Ren, Maarten de Rijke, Zhaochun Ren","Recent work on knowledge graph completion (KGC) focused on learning embeddings of entities and relations in knowledge graphs. These embedding methods require that all test entities are observed at training time, resulting in a time-consuming retraining process for out-of-knowledge-graph (OOKG) entities. To address this issue, current inductive knowledge embedding methods employ graph neural networks (GNNs) to represent unseen entities by aggregating information of known neighbors. They face three important challenges: (i) data sparsity, (ii) the presence of complex patterns in knowledge graphs (e.g., inter-rule correlations), and (iii) the presence of interactions among rule mining, rule inference, and embedding. In this paper, we propose a virtual neighbor network with inter-rule correlations (VNC) that consists of three stages: (i) rule mining, (ii) rule inference, and (iii) embedding. In the rule mining process, to identify complex patterns in knowledge graphs, both logic rules and inter-rule correlations are extracted from knowledge graphs based on operations over relation embeddings. To reduce data sparsity, virtual neighbors for OOKG entities are predicted and assigned soft labels by optimizing a rule-constrained problem. We also devise an iterative framework to capture the underlying relations between rule learning and embedding learning. In our experiments, results on both link prediction and triple classification tasks show that the proposed VNC framework achieves state-of-the-art performance on four widely-used knowledge graphs. Further analysis reveals that VNC is robust to the proportion of unseen entities and effectively mitigates data sparsity. △ Less",https://arxiv.orghttps://arxiv.org/abs/2305.10531,May 2023
Time Series Clustering With Random Convolutional Kernels,"Jorge Marco-Blanco, Rubén Cuevas","Time series data, spanning applications ranging from climatology to finance to healthcare, presents significant challenges in data mining due to its size and complexity. One open issue lies in time series clustering, which is crucial for processing large volumes of unlabeled time series data and unlocking valuable insights. Traditional and modern analysis methods, however, often struggle with these complexities. To address these limitations, we introduce R-Clustering, a novel method that utilizes convolutional architectures with randomly selected parameters. Through extensive evaluations, R-Clustering demonstrates superior performance over existing methods in terms of clustering accuracy, computational efficiency and scalability. Empirical results obtained using the UCR archive demonstrate the effectiveness of our approach across diverse time series datasets. The findings highlight the significance of R-Clustering in various domains and applications, contributing to the advancement of time series data mining. △ Less",https://arxiv.orghttps://arxiv.org/abs/2305.10457,May 2023
CLIP-GCD: Simple Language Guided Generalized Category Discovery,"Rabah Ouldnoughi, Chia-Wen Kuo, Zsolt Kira","Generalized Category Discovery (GCD) requires a model to both classify known categories and cluster unknown categories in unlabeled data. Prior methods leveraged self-supervised pre-training combined with supervised fine-tuning on the labeled data, followed by simple clustering methods. In this paper, we posit that such methods are still prone to poor performance on out-of-distribution categories, and do not leverage a key ingredient: Semantic relationships between object categories. We therefore propose to leverage multi-modal (vision and language) models, in two complementary ways. First, we establish a strong baseline by replacing uni-modal features with CLIP, inspired by its zero-shot performance. Second, we propose a novel retrieval-based mechanism that leverages CLIP's aligned vision-language representations by mining text descriptions from a text corpus for the labeled and unlabeled set. We specifically use the alignment between CLIP's visual encoding of the image and textual encoding of the corpus to retrieve top-k relevant pieces of text and incorporate their embeddings to perform joint image+text semi-supervised clustering. We perform rigorous experimentation and ablations (including on where to retrieve from, how much to retrieve, and how to combine information), and validate our results on several datasets including out-of-distribution domains, demonstrating state-of-art results. △ Less",https://arxiv.orghttps://arxiv.org/abs/2305.10420,May 2023
Bug or not Bug? Analysing the Reasons Behind Metamorphic Relation Violations,"Alejandra Duque-Torres, Dietmar Pfahl, Claus Klammer, Stefan Fischer","Metamorphic Testing (MT) is a testing technique that can effectively alleviate the oracle problem. MT uses Metamorphic Relations (MRs) to determine if a test case passes or fails. MRs specify how the outputs should vary in response to specific input changes when executing the System Under Test (SUT). If a particular MR is violated for at least one test input (and its change), there is a high probability that the SUT has a fault. On the other hand, if a particular MR is not violated, it does not guarantee that the SUT is fault free. However, deciding if the MR is being violated due to a bug or because the MR does not hold/fit for particular conditions generated by specific inputs remains a manual task and unexplored. In this paper, we develop a method for refining MRs to offer hints as to whether a violation results from a bug or arises from the MR not being matched to certain test data under specific circumstances. In our initial proof-of-concept, we derive the relevant information from rules using the Association Rule Mining (ARM) technique. In our initial proof-of-concept, we validate our method on a toy example and discuss the lessons learned from our experiments. Our proof-of-concept demonstrates that our method is applicable and that we can provide suggestions that help strengthen the test suite for regression testing purposes. △ Less",https://arxiv.orghttps://arxiv.org/abs/2305.09640,May 2023
Fuzzy Temporal Protoforms for the Quantitative Description of Processes in Natural Language,"Yago Fontenla-Seco, Alberto Bugarín-Diz, Manuel Lama","In this paper, we propose a series of fuzzy temporal protoforms in the framework of the automatic generation of quantitative and qualitative natural language descriptions of processes. The model includes temporal and causal information from processes and attributes, quantifies attributes in time during the process life-span and recalls causal relations and temporal distances between events, among other features. Through integrating process mining techniques and fuzzy sets within the usual Data-to-Text architecture, our framework is able to extract relevant quantitative temporal as well as structural information from a process and describe it in natural language involving uncertain terms. A real use-case in the cardiology domain is presented, showing the potential of our model for providing natural language explanations addressed to domain experts. △ Less",https://arxiv.orghttps://arxiv.org/abs/2305.09506,May 2023
"Interplay between Topology and Edge Weights in Real-World Graphs: Concepts, Patterns, and an Algorithm","Fanchen Bu, Shinhwan Kang, Kijung Shin","What are the relations between the edge weights and the topology in real-world graphs? Given only the topology of a graph, how can we assign realistic weights to its edges based on the relations? Several trials have been done for edge-weight prediction where some unknown edge weights are predicted with most edge weights known. There are also existing works on generating both topology and edge weights of weighted graphs. Differently, we are interested in generating edge weights that are realistic in a macroscopic scope, merely from the topology, which is unexplored and challenging. To this end, we explore and exploit the patterns involving edge weights and topology in real-world graphs. Specifically, we divide each graph into layers where each layer consists of the edges with weights at least a threshold. We observe consistent and surprising patterns appearing in multiple layers: the similarity between being adjacent and having high weights, and the nearly-linear growth of the fraction of edges having high weights with the number of common neighbors. We also observe a power-law pattern that connects the layers. Based on the observations, we propose PEAR, an algorithm assigning realistic edge weights to a given topology. The algorithm relies on only two parameters, preserves all the observed patterns, and produces more realistic weights than the baseline methods with more parameters. △ Less",https://arxiv.orghttps://arxiv.org/abs/2305.09083,May 2023
New methods for new data? An overview and illustration of quantitative inductive methods for HRM research,Alain LACROUX,"""Data is the new oil"", in short, data would be the essential source of the ongoing fourth industrial revolution, which has led some commentators to assimilate too quickly the quantity of data to a source of wealth in itself, and consider the development of big data as an quasi direct cause of profit. Human resources management is not escaping this trend, and the accumulation of large amounts of data on employees is perceived by some entrepreneurs as a necessary and sufficient condition for the construction of predictive models of complex work behaviors such as absenteeism or job performance. In fact, the analogy is somewhat misleading: unlike oil, there are no major issues here concerning the production of data (whose flows are generated continuously and at low cost by various information systems), but rather their ''refining'', i.e. the operations necessary to transform this data into a useful product, namely into knowledge. This transformation is where the methodological challenges of data valuation lie, both for practitioners and for academic researchers. Considerations on the methods applicable to take advantage of the possibilities offered by these massive data are relatively recent, and often highlight the disruptive aspect of the current ''data deluge'' to point out that this evolution would be the source of a revival of empiricism in a ''fourth paradigm'' based on the intensive and ''agnostic'' exploitation of massive amounts of data in order to bring out new knowledge, following a purely inductive logic. Although we do not adopt this speculative point of view, it is clear that data-driven approaches are scarce in quantitative HRM studies. However, there are well-established methods, particularly in the field of data mining, which are based on inductive approaches. This area of quantitative analysis with an inductive aim is still relatively unexplored in HRM ( apart from typological analyses). The objective of this paper is first to give an overview of data driven methods that can be used for HRM research, before proposing an empirical illustration which consists in an exploratory research combining a latent profile analysis and an exploration by Gaussian graphical models. △ Less",https://arxiv.orghttps://arxiv.org/abs/2305.08889,May 2023
Identification of the Factors Affecting the Reduction of Energy Consumption and Cost in Buildings Using Data Mining Techniques,"Hamed Khosravi, Hadi Sahebi, Rahim khanizad, Imtiaz Ahmed","Optimizing energy consumption and coordination of utility systems have long been a concern of the building industry. Buildings are one of the largest energy consumers in the world, making their energy efficiency crucial for preventing waste and reducing costs. Additionally, buildings generate substantial amounts of raw data, which can be used to understand energy consumption patterns and assist in developing optimization strategies. Using a real-world dataset, this research aims to identify the factors that influence building cost reduction and energy consumption. To achieve this, we utilize three regression models (Lasso Regression, Decision Tree, and Random Forest) to predict primary fuel usage, electrical energy consumption, and cost savings in buildings. An analysis of the factors influencing energy consumption and cost reduction is conducted, and the decision tree algorithm is optimized using metaheuristics. By employing metaheuristic techniques, we fine-tune the decision tree algorithm's parameters and improve its accuracy. Finally, we review the most practical features of potential and nonpotential buildings that can reduce primary fuel usage, electrical energy consumption, and costs △ Less",https://arxiv.orghttps://arxiv.org/abs/2305.08886,May 2023
Comparing Variation in Tokenizer Outputs Using a Series of Problematic and Challenging Biomedical Sentences,"Christopher Meaney, Therese A Stukel, Peter C Austin, Michael Escobar","Background & Objective: Biomedical text data are increasingly available for research. Tokenization is an initial step in many biomedical text mining pipelines. Tokenization is the process of parsing an input biomedical sentence (represented as a digital character sequence) into a discrete set of word/token symbols, which convey focused semantic/syntactic meaning. The objective of this study is to explore variation in tokenizer outputs when applied across a series of challenging biomedical sentences. Method: Diaz [2015] introduce 24 challenging example biomedical sentences for comparing tokenizer performance. In this study, we descriptively explore variation in outputs of eight tokenizers applied to each example biomedical sentence. The tokenizers compared in this study are the NLTK white space tokenizer, the NLTK Penn Tree Bank tokenizer, Spacy and SciSpacy tokenizers, Stanza/Stanza-Craft tokenizers, the UDPipe tokenizer, and R-tokenizers. Results: For many examples, tokenizers performed similarly effectively; however, for certain examples, there were meaningful variation in returned outputs. The white space tokenizer often performed differently than other tokenizers. We observed performance similarities for tokenizers implementing rule-based systems (e.g. pattern matching and regular expressions) and tokenizers implementing neural architectures for token classification. Oftentimes, the challenging tokens resulting in the greatest variation in outputs, are those words which convey substantive and focused biomedical/clinical meaning (e.g. x-ray, IL-10, TCR/CD3, CD4+ CD8+, and (Ca2+)-regulated). Conclusion: When state-of-the-art, open-source tokenizers from Python and R were applied to a series of challenging biomedical example sentences, we observed subtle variation in the returned outputs. △ Less",https://arxiv.orghttps://arxiv.org/abs/2305.08787,May 2023
Causal Data Integration,"Brit Youngmann, Michael Cafarella, Babak Salimi, Anna Zeng","Causal inference is fundamental to empirical scientific discoveries in natural and social sciences; however, in the process of conducting causal inference, data management problems can lead to false discoveries. Two such problems are (i) not having all attributes required for analysis, and (ii) misidentifying which attributes are to be included in the analysis. Analysts often only have access to partial data, and they critically rely on (often unavailable or incomplete) domain knowledge to identify attributes to include for analysis, which is often given in the form of a causal DAG. We argue that data management techniques can surmount both of these challenges. In this work, we introduce the Causal Data Integration (CDI) problem, in which unobserved attributes are mined from external sources and a corresponding causal DAG is automatically built. We identify key challenges and research opportunities in designing a CDI system, and present a system architecture for solving the CDI problem. Our preliminary experimental results demonstrate that solving CDI is achievable and pave the way for future research. △ Less",https://arxiv.orghttps://arxiv.org/abs/2305.08741,May 2023
